Name,Type,Foundation,Price,Size,Length,Width,Bedrooms,Bathrooms,Lofts,Misc,Location,Link,City,State,Country,Days on site,Number of views,Times dreamlisted
Move in ready Tiny Home,Container Home,Stationary,38000,144.0,18.0,8.0,0,1,1,Square Feet,"Dinuba , California, United States",https://tinyhouselistings.com/listings/move-in-ready-tiny-home,Dinuba ,California,United States,136,0,24.0
Brand New Luxury Container Home,Container Home,Stationary,65000,320.0,40.0,8.0,1,1,0,New,"Royse City, Texas, United States",https://tinyhouselistings.com/listings/brand-new-luxury-container-home,Royse City,Texas,United States,137,0,104.0
2018 Cabin Home for sale,Other,Stationary,43000,300.0,32.0,12.0,1,1,2,Used,"Wink, Texas, United States",https://tinyhouselistings.com/listings/2018-cabin-home-for-sale,Wink,Texas,United States,138,0,18.0
Brand New Luxury Tiny Home For Sale,Tiny House,Mobile,85000,200.0,20.0,8.5,1,1,2,Delivery Available,"Hildale, Utah, United States",https://tinyhouselistings.com/listings/brand-new-luxury-tiny-home-for-sale,Hildale,Utah,United States,140,0,343.0
La Canada Adventurer 1948 travel trailer,RV,Mobile,9800,170.0,19.0,9.0,1,0,0,Square Feet,"Madrid, New Mexico, United States",https://tinyhouselistings.com/listings/la-canada-adventurer-1948-travel-trailer,Madrid,New Mexico,United States,141,0,96.0
Great Tiny House with Big Kitchen!,Tiny House,Mobile,80000,200.0,24.0,8.0,0,1,1,Delivery Available,"Medford , New York, United States",https://tinyhouselistings.com/listings/great-tiny-house-with-big-kitchen,Medford ,New York,United States,141,0,137.0
Cabin Style 24' Tiny House - Reduced price!,Tiny House,Mobile,54000,220.0,24.0,8.0,2,1,1,Delivery Available,"Chattanooga, Tennessee, United States",https://tinyhouselistings.com/listings/affordable-tiny-house-reduced-price-49d54732-c764-4a17-93c1-f45b845c7b07,Chattanooga,Tennessee,United States,142,0,48.0
"Handcrafted Tiny Guest House for Sale $30,000",Tiny House,Mobile,30000,127.0,17.0,8.0,1,1,2,Used,"Windsor, California, United States",https://tinyhouselistings.com/listings/handcrafted-tiny-guest-house-for-sale-35-000,Windsor,California,United States,143,0,65.0
Cabin in Texas,Cabin,Mobile,40000,20.0,20.0,20.0,2,1,0,Used,"Georgetown, Texas, United States",https://tinyhouselistings.com/listings/cabin-in-texas,Georgetown,Texas,United States,143,0,49.0
Modular Nordic Style Tiny Houses and Studios,Tiny House,Mobile,9000,130.0,16.0,8.0,0,0,0,Delivery Available,"Monterey, Tennessee, United States",https://tinyhouselistings.com/listings/nordic-and-spruce-custom-tinyhouses-and-studios,Monterey,Tennessee,United States,144,0,328.0
Custom Cedar Front Tiny with Flush Toilet and Sleeps 4,Tiny House,Mobile,50000,250.0,20.0,8.5,2,1,1,New,"Bluffton, Ohio, United States",https://tinyhouselistings.com/listings/price-reduced-cozy-and-beautiful-custom-tiny-on-wheels-tiny_house,Bluffton,Ohio,United States,144,0,389.0
Affordable 20' Container Home on Wheels for $20k,Container Home,Mobile,20000,160.0,20.0,8.0,0,1,1,Delivery Available,"Elwood, Utah, United States",https://tinyhouselistings.com/listings/affordable-20-container-home-on-wheels-for-20k,Elwood,Utah,United States,144,0,130.0
ECO Container Tiny House (Can be shipped to you),Container Home,Stationary,31999,160.0,,,0,1,1,New,"chicago, Illinois, United States",https://tinyhouselistings.com/listings/eco-container-tiny-house-can-be-shipped-to-you,chicago,Illinois,United States,146,0,127.0
"This quaint, country, songwriters cabin is a wonderful place to live, vacation, seek solitude or play. It offers a little something for everyone.",Cabin,Stationary,85000,240.0,20.0,12.0,4,1,2,Comes With Land,"Nunnelly, Tennessee, United States",https://tinyhouselistings.com/listings/this-quaint-country-songwriters-cabin-is-a-wonderful-place-to-live-vacation-seek-solitude-or-play-it-offers-a-little-something-for-everyone,Nunnelly,Tennessee,United States,146,0,219.0
2004 Ford E-450 7.3L Diesel Engine Tiny House/Mini Bus For Sale!,Converted Bus,Mobile,52000,125.0,,,2,0,0,Square Feet,"Croton on Hudson, New York, United States",https://tinyhouselistings.com/listings/2004-ford-e-450-7-3l-diesel-engine-tiny-house-mini-bus-for-sale-converted_bus,Croton on Hudson,New York,United States,147,0,173.0
Tiny House Frame ready for customization,Tiny House Trailer,Mobile,20000,160.0,20.0,8.0,1,1,1,New,"DALLAS, Texas, United States",https://tinyhouselistings.com/listings/tiny-house-frame-ready-for-customization,DALLAS,Texas,United States,102,0,37.0
"Premium parking in rural Texas, minutes from San Antonio & New Braunfels!!",Parking,Stationary,700,10000.0,,,0,0,0,Square Feet,"Marion, Texas, United States",https://tinyhouselistings.com/listings/premium-parking-in-rural-texas-minutes-from-san-antonio-new-braunfels,Marion,Texas,United States,149,0,25.0
"The New 2021 Ranch House Under $55,000",Park Model,Mobile,54875,399.0,32.0,15.0,1,1,0,New,"Mansfield, Texas, United States",https://tinyhouselistings.com/listings/the-new-2021-ranch-house-under-50-000,Mansfield,Texas,United States,151,0,566.0
Duramax Gable Roof Tiny House/Insulated Building 8.5' x 20',Tiny House,Stationary,7599,160.0,20.0,8.5,1,1,1,New,"Los Angeles, California, United States",https://tinyhouselistings.com/listings/duramax-gable-roof-tiny-house-insulated-building-8-5-x-20,Los Angeles,California,United States,152,0,44.0
Mt Bachelor,Park Model,Mobile,76995,400.0,43.0,12.0,1,1,1,Delivery Available,"Salem, Oregon, United States",https://tinyhouselistings.com/listings/mt-bachelor-park_model,Salem,Oregon,United States,153,0,259.0
Cute Tiny House Near Downtown Denver,Tiny House,Mobile,32000,250.0,20.0,25.0,1,1,1,Used,"Lakewood, Colorado, United States",https://tinyhouselistings.com/listings/cute-tiny-house-near-downtown-denver,Lakewood,Colorado,United States,154,0,23.0
20’ Mobile Container Home,Container Home,Mobile,20000,160.0,20.0,8.0,1,1,1,Delivery Available,"Elwood, Utah, United States",https://tinyhouselistings.com/listings/20-mobile-container-home,Elwood,Utah,United States,156,0,118.0
Luxurious 35' GooseneckTiny House For Sale! With a kegerator,Tiny House,Mobile,132500,280.0,35.0,8.5,1,1,1,Delivery Available,"Chattanooga, Tennessee, United States",https://tinyhouselistings.com/listings/luxurious-35-goosenecktiny-house-for-sale-with-a-kegerator-tiny_house,Chattanooga,Tennessee,United States,157,0,390.0
